[
 {
  "id": "scale-70pc",
  "claim": "Roughly 70% of the internet is affected",
  "by": "Wiz",
  "sources": [
   "bbc-live-ckgel5xp2xv9t"
  ],
  "status": "unverified",
  "note": "BBC: 'unable to independently verify that figure'",
  "agent": "claude-newsroom-lead"
 },
 {
  "id": "scale-30m",
  "claim": "Something like 30 million websites could be affected",
  "by": "Alan Woodward, Surrey Centre for Cyber Security",
  "sources": [
   "bbc-live-ckgel5xp2xv9t"
  ],
  "status": "reported",
  "agent": "claude-newsroom-lead"
 },
 {
  "id": "two-vulns",
  "claim": "Two critical vulnerabilities",
  "by": "NSA Cybersecurity (X)",
  "sources": [
   "bbc-live-ckgel5xp2xv9t"
  ],
  "status": "reported",
  "note": "need the NSA post itself and the CVE IDs",
  "agent": "claude-newsroom-lead"
 },
 {
  "id": "ai-found",
  "claim": "Found using frontier AI (ChatGPT) by Calif, then Wiz and OpenAI; 'a complex chain of steps, at the edge of what human researchers could practically achieve'",
  "by": "Calif, Wiz, OpenAI",
  "sources": [
   "bbc-live-ckgel5xp2xv9t"
  ],
  "status": "reported",
  "agent": "claude-newsroom-lead"
 },
 {
  "id": "most-severe-ai",
  "claim": "The 'most severe' flaws ever detected by AI",
  "by": "Wiz",
  "sources": [
   "bbc-live-ckgel5xp2xv9t"
  ],
  "status": "reported",
  "agent": "claude-newsroom-lead"
 },
 {
  "id": "leak-video",
  "claim": "Calif 'mistakenly published a video' showing basic details of how the flaws could be used",
  "by": "PHP Foundation (as reported by the BBC)",
  "sources": [
   "bbc-live-ckgel5xp2xv9t"
  ],
  "status": "reported",
  "note": "Calif's own account needed",
  "agent": "claude-newsroom-lead"
 },
 {
  "id": "vibe-code",
  "claim": "Criminals are using AI to 'vibe code' an attack method",
  "by": "unnamed researchers (BBC)",
  "sources": [
   "bbc-live-ckgel5xp2xv9t"
  ],
  "status": "unverified",
  "agent": "claude-newsroom-lead"
 },
 {
  "id": "probing",
  "claim": "Amazon and Cloudflare saw sites being probed for the flaw",
  "by": "Alan Woodward",
  "sources": [
   "bbc-live-ckgel5xp2xv9t"
  ],
  "status": "reported",
  "note": "second-hand; need AWS or Cloudflare statements",
  "agent": "claude-newsroom-lead"
 },
 {
  "id": "no-exploitation",
  "claim": "No evidence yet that hackers have exploited the flaw",
  "by": "Ryan Austin, Calif (08:00 BST)",
  "sources": [
   "bbc-live-ckgel5xp2xv9t"
  ],
  "status": "reported",
  "agent": "claude-newsroom-lead"
 },
 {
  "id": "impact-unauth",
  "claim": "Attackers could take control of affected web servers without authentication and steal data",
  "by": "Paul Spain, Gorilla Cyber Security; Woodward",
  "sources": [
   "bbc-live-ckgel5xp2xv9t"
  ],
  "status": "reported",
  "agent": "claude-newsroom-lead"
 },
 {
  "id": "offline-advice",
  "claim": "Where immediate remediation is not feasible, take the system offline until fully mitigated",
  "by": "UK NCSC; NSA; EU and Australian counterparts",
  "sources": [
   "bbc-live-ckgel5xp2xv9t"
  ],
  "status": "reported",
  "agent": "claude-newsroom-lead"
 },
 {
  "id": "affected-sites",
  "claim": "Wikipedia (parts), Edinburgh council, French government sites, the University of Geneva, online shops and the BBC affected or taken offline",
  "by": "BBC",
  "sources": [
   "bbc-live-ckgel5xp2xv9t"
  ],
  "status": "reported",
  "agent": "claude-newsroom-lead"
 },
 {
  "id": "two-cves-9.2",
  "claim": "Two critical vulnerabilities, CVE-2026-109618 and CVE-2026-109619, each CVSS v4.0 9.2, fixed in PHP 8.5.12, 8.4.27, 8.3.36 and 8.2.35",
  "by": "PHP Group (CNA), GitHub advisories, php.net",
  "sources": [
   "cve-cve-2026-109618",
   "cve-cve-2026-109619",
   "github-ghsa-w8hw-w9fx-j79w",
   "github-ghsa-6wmf-4rv5-p3rp",
   "php-net-advisory"
  ],
  "status": "confirmed",
  "topic": "technical",
  "agent": "claude-story-site"
 },
 {
  "id": "cvss-10",
  "claim": "The flaws are CVSS 10.0",
  "by": "social posts on 20 October, relayed by a vendor and a news site",
  "sources": [
   "php-foundation-blog-security-release",
   "daubois-blog-php2shell-rumors"
  ],
  "status": "disputed",
  "topic": "technical",
  "note": "contradicted by a primary source. The PHP Foundation: 'a wrong CVSS score of 10.0 (the actual score is 9.2)'. Daubois traces it to a social post relayed by Phoenix Security and to watchTowr via Cyber Daily.",
  "agent": "claude-story-site"
 },
 {
  "id": "rce-modphp",
  "claim": "Unauthenticated RCE over HTTP against Apache mod_php with default settings, before any application code runs",
  "by": "PHP security team (GHSA, oss-security), php.net",
  "sources": [
   "github-ghsa-w8hw-w9fx-j79w",
   "openwall-oss-security-2026-10-21-6",
   "php-net-advisory"
  ],
  "status": "confirmed",
  "topic": "technical",
  "agent": "claude-story-site"
 },
 {
  "id": "rce-fpm",
  "claim": "Remote code execution is confirmed on PHP-FPM",
  "by": "PHP Foundation blog; GHSA-6wmf for the session path",
  "sources": [
   "php-foundation-blog-security-release",
   "github-ghsa-6wmf-4rv5-p3rp",
   "github-ghsa-w8hw-w9fx-j79w",
   "openwall-oss-security-2026-10-21-6"
  ],
  "status": "disputed",
  "topic": "technical",
  "note": "GHSA-w8hw (CVE-2026-109618): 'no complete FPM exploit has been demonstrated for this SAPI'. The Foundation blog: RCE 'was also confirmed on PHP-FPM through application-level code paths'. GHSA-6wmf (CVE-2026-109619): session lifecycle RCE 'validated against mod_php and FPM'. The accounts may refer to different CVEs.",
  "agent": "claude-story-site"
 },
 {
  "id": "fix-bailout",
  "claim": "The fix removes longjmp() for out-of-memory errors in favour of a delayed soft OOM at the next VM safe point and a hard OOM via _exit(); the changelog line is 'Avoid state corruption via bailout'",
  "by": "PHP security team",
  "sources": [
   "github-ghsa-w8hw-w9fx-j79w",
   "php-net-changelog-8",
   "github-php-src-branch-7.4-backport"
  ],
  "status": "confirmed",
  "topic": "technical",
  "agent": "claude-story-site"
 },
 {
  "id": "fix-incomplete",
  "claim": "The 8.5.12 fix may be incomplete, or there is a third, different bug",
  "by": "Fediverse posts relayed to oss-security by Aaron Rainbolt and Yves-Alexis Perez",
  "sources": [
   "openwall-oss-security-109619-thread"
  ],
  "status": "unverified",
  "topic": "technical",
  "note": "Per a Matrix channel, Canonical asked PHP and 'was told that it's unrelated and not a real issue'. Second-hand. Nothing from PHP on the list at capture.",
  "agent": "claude-story-site"
 },
 {
  "id": "versions-old",
  "claim": "All PHP versions from 5 onwards are affected by at least one of the flaws",
  "by": "NCSC-NL; Wiz ('>= 5.4'); CERT-FR (5.x, 6.x, 7.x, 8.0, 8.1)",
  "sources": [
   "ncsc-nl-advisories",
   "x-wiz-io-php2shell",
   "certfr-2026-ale-014",
   "openwall-oss-security-109619-thread"
  ],
  "status": "disputed",
  "topic": "technical",
  "note": "The CVE records list only 8.2 to 8.5 with defaultStatus 'unaffected'. php.net published source backports for 7.4, 8.0 and 8.1, which implies they are affected. A scanner that trusts the CVE record will miss 7.4 to 8.1.",
  "agent": "claude-story-site"
 },
 {
  "id": "only-update",
  "claim": "Updating is the only complete mitigation; the configuration measures reduce exposure to specific paths and do not make an installation safe",
  "by": "php.net; PHP security team",
  "sources": [
   "php-net-advisory",
   "openwall-oss-security-2026-10-21-7",
   "github-ghsa-6wmf-4rv5-p3rp"
  ],
  "status": "confirmed",
  "topic": "technical",
  "agent": "claude-story-site"
 },
 {
  "id": "waf",
  "claim": "A web application firewall may provide some protection until systems are patched",
  "by": "CISA",
  "sources": [
   "cisa-alert-php-20261021",
   "ch-bacs-warnung-php",
   "cloudflare-blog-php2shell-waf"
  ],
  "status": "disputed",
  "topic": "technical",
  "note": "Swiss BACS: 'Even a web application firewall alone is not sufficient.' Cloudflare says its rules blocked the traffic it saw and that attackers mutated payloads to get past them.",
  "agent": "claude-story-site"
 },
 {
  "id": "wordpress-drupal",
  "claim": "Pre-authentication RCE was confirmed against WordPress, Drupal, Joomla, MediaWiki, Roundcube, Magento, phpMyAdmin, Nextcloud, Laravel, Symfony and WHMCS",
  "by": "Calif; Wiz for WordPress and Drupal",
  "sources": [
   "calif-php2shell",
   "wiz-blog-php2shell"
  ],
  "status": "reported",
  "topic": "technical",
  "note": "Two researcher parties, no third-party reproduction in the vault. The demo videos were not downloaded.",
  "agent": "claude-story-site"
 },
 {
  "id": "scale-70pc-internet",
  "claim": "Roughly 70% of the Internet is affected",
  "by": "Wiz (headline, X post); BBC attributing Wiz",
  "sources": [
   "wiz-blog-php2shell",
   "x-wiz-io-php2shell",
   "bbc-live-ckgel5xp2xv9t"
  ],
  "status": "unverified",
  "topic": "scale",
  "note": "The BBC was 'unable to independently verify that figure'. Wiz's body text says 70% of websites and cites no measurement.",
  "agent": "claude-story-site"
 },
 {
  "id": "scale-70pc-websites",
  "claim": "PHP is used by almost 70% of websites",
  "by": "Cloudflare; OpenAI ('an estimated 70%'); Wiz body text",
  "sources": [
   "cloudflare-blog-php2shell-waf",
   "x-openai-php2shell",
   "wiz-blog-php2shell"
  ],
  "status": "reported",
  "topic": "scale",
  "note": "None of the three cites the survey it comes from. A share of websites using PHP is an upper bound on exposure, not a count of vulnerable systems.",
  "agent": "claude-story-site"
 },
 {
  "id": "scale-30m",
  "claim": "Something like 30 million websites could be affected",
  "by": "Alan Woodward, via the BBC",
  "sources": [
   "bbc-live-ckgel5xp2xv9t"
  ],
  "status": "reported",
  "topic": "scale",
  "note": "No basis given.",
  "agent": "claude-story-site"
 },
 {
  "id": "scale-2.6m-hosts",
  "claim": "PHP is exposed on 2,608,039 internet-facing hosts",
  "by": "VulnCheck, via The Hacker News",
  "sources": [
   "thehackernews-php2shell-4days"
  ],